,question,answer,contexts,ground_truth,faithfulness,answer_relevancy,context_recall,context_precision,answer_correctness
0,شرایط تاجر بودن چیست؟,شرایط تاجر بودن شامل انجام معاملات باعتبار تاجر بودن متعاملین یا یکی از آنها، انجام معاملات برای حوائج تجارتی خود، انجام معاملات برای امور تجارتی ارباب خود و انجام معاملات با تجار، کسبه، صرافان و بانک‌ها می‌باشد.,['ماده 3 - معاملات ذيل باعتبار تاجر بودن متعاملين يا يكي از آنها تجارتي محسوب ميشود: 1) كليه معاملات بين تجار و كسبه و صرافان و بانكها. 2) كليه معاملاتي كه تاجر يا غير تاجر براي حوائج تجارتي خود مينمايد. 3) كليه معاملاتيكه اجزاء يا خدمه يا شاگرد تاجر براي امور تجارتي ارباب خود مينمايد. 4) كليه'],تاجر کسی است که شغل معمولی خود را معاملات تجارتی قرار دهد. (ماده 1),1.0,0.9088042428635842,1.0,0.0,0.8713178049154227
1,خرید یا تحصیل مال منقول برای چه منظوری جزء معاملات تجارتی محسوب می‌شود؟,برای فروش یا اجاره,"['ماده 2 - معاملات تجارتي از قرار ذيل است:\n\n1) خريد يا تحصيل هر نوع مال منقول بقصد فروش يا اجاره اعم از اينكه تصرفاتي در آن شده يا نشده باشد.\n\n2) تصدي به حمل و نقل از راه خشكي يا آب يا هوا بهر نحوي كه باشد.'
 '\u200cماده 373 - اگر حق\u200cالعمل\u200c كار مأمور بخريد يا فروش مال\u200c التجاره يا اسناد تجارتي و يا ساير اوراق بهاداري باشد كه مظنه بورسي يا بازاري دارد\u200c ميتواند چيزي را كه مأمور بخريد آن بوده خود شخصاً بعنوان فروشنده تسليم بكند و يا چيزيرا كه مأمور بفروش آن بوده شخصاً بعنوان \u200cخريدار نگاهدارد مگر اينكه آمر دستور'
 'ماده 3 - معاملات ذيل باعتبار تاجر بودن متعاملين يا يكي از آنها تجارتي محسوب ميشود: 1) كليه معاملات بين تجار و كسبه و صرافان و بانكها. 2) كليه معاملاتي كه تاجر يا غير تاجر براي حوائج تجارتي خود مينمايد. 3) كليه معاملاتيكه اجزاء يا خدمه يا شاگرد تاجر براي امور تجارتي ارباب خود مينمايد. 4) كليه']",برای فروش یا اجاره، چه تصرفاتی در آن شده باشد یا نشده باشد. (ماده 2),1.0,0.0,1.0,0.9999999999,0.7287245258988038
2,انواع عملیاتی که جزء معاملات تجارتی محسوب می‌شوند، کدامند؟,"1) معاملات بین تجار و کسبه و صرافان و بانک‌ها
2) معاملاتی که تاجر یا غیر تاجر برای حوائج تجارتی خود انجام می‌دهند
3) معاملاتی که اجزاء یا خدمه یا شاگرد تاجر برای امور تجارتی ارباب خود انجام می‌دهند","['ماده 4 - معاملات غير منقول بهيچوجه تجارتي محسوب نميشود.\n\nماده 5 - كليه معاملات تجار تجارتي محسوب است مگر اينكه ثابت شود معامله مربوط بامور تجارتي نيست.\n\nباب دوم \u200cدفاتر تجارتي و دفتر ثبت تجارتي\n\nفصل اول\n\nدفاتر تجارتي'
 '\u200cماده 7 - دفتر روزنامه دفتري است كه تاجر بايد همه روزه مطالبات و ديون و داد و ستد تجارتي و معاملات راجع به اوراق تجارتي (\u200cاز قبيل خريد و\u200c فروش و ظهرنويسي) و بطور كلي جميع واردات و صادرات تجارتي خود را بهر اسم و رسمي كه باشد و وجوهي را كه براي مخارج شخصي خود \u200cبرداشت ميكند در آن دفتر ثبت نمايد.'
 'ماده 3 - معاملات ذيل باعتبار تاجر بودن متعاملين يا يكي از آنها تجارتي محسوب ميشود: 1) كليه معاملات بين تجار و كسبه و صرافان و بانكها. 2) كليه معاملاتي كه تاجر يا غير تاجر براي حوائج تجارتي خود مينمايد. 3) كليه معاملاتيكه اجزاء يا خدمه يا شاگرد تاجر براي امور تجارتي ارباب خود مينمايد. 4) كليه']",عملیات دلالی، حق‌العمل‌کاری، عاملی و تأسیسات مربوط به انجام بعضی امور. (ماده 2),1.0,0.8169242766928054,1.0,0.8333333332916666,0.2197511599281381
3,تأسیس و به کار انداختن کارخانه تحت چه شرایطی جزء معاملات تجارتی است؟,با توجه به متن بالا، تأسیس و به کار انداختن کارخانه جزء معاملات تجارتی است که نیاز به انجام معاملات مالی، قانونی و اداری دارد.,[],برای رفع حوائج شخصی نباشد. (ماده 2),1.0,0.0,0.0,0.0,0.2027271840675749
4,چه نوع معاملاتی بین تجار و کسبه تجارتی محسوب می‌شود؟,کلیه معاملات بین تجار و کسبه تجارتی محسوب می‌شود.,"['ماده 3 - معاملات ذيل باعتبار تاجر بودن متعاملين يا يكي از آنها تجارتي محسوب ميشود: 1) كليه معاملات بين تجار و كسبه و صرافان و بانكها. 2) كليه معاملاتي كه تاجر يا غير تاجر براي حوائج تجارتي خود مينمايد. 3) كليه معاملاتيكه اجزاء يا خدمه يا شاگرد تاجر براي امور تجارتي ارباب خود مينمايد. 4) كليه'
 '\u200cماده 7 - دفتر روزنامه دفتري است كه تاجر بايد همه روزه مطالبات و ديون و داد و ستد تجارتي و معاملات راجع به اوراق تجارتي (\u200cاز قبيل خريد و\u200c فروش و ظهرنويسي) و بطور كلي جميع واردات و صادرات تجارتي خود را بهر اسم و رسمي كه باشد و وجوهي را كه براي مخارج شخصي خود \u200cبرداشت ميكند در آن دفتر ثبت نمايد.'
 'ماده 356 - هر دلال بايد دفتري داشته و كليه معاملاتي را كه بدلالي او انجام گرفته بترتيب ذيل در آن ثبت نمايد: 1) اسم متعاملين. 2) مالي كه موضوع معامله است. 3) نوع معامله. 4) شرايط معامله با تشخيص باينكه تسليم موضوع معامله فوري است يا بوعده است. 5) عوض مالي كه بايد پرداخته شود و تشخيص اينكه فوري است']",کلیه معاملات بین تجار و کسبه و صرافان و بانک‌ها. (ماده 3),1.0,0.8051819820970264,1.0,0.8333333332916666,0.7372354914719368
5,دفاتری که تاجر باید داشته باشد کدامند؟,"1) دفتر روزنامه
2) دفتر کل
3) دفتر دارائی
4) دفتر کپیه","['ماده 438 - انبارها و حجره\u200cها و صندوق و اسناد و دفاتر و نوشتجات و اسباب و اثاثيه تجارتخانه و منزل تاجر بايد مهر موم شود.'
 'باب دوم \u200cدفاتر تجارتي و دفتر ثبت تجارتي\n\nفصل اول\n\nدفاتر تجارتي\n\nماده 6 - هر تاجري به استثناي كسبه جزء مكلف است دفاتر ذيل يا دفاتر ديگري را كه وزارت عدليه بموجب نظامنامه قائم\u200cمقام اين دفاتر قرار\u200cميدهد داشته باشد: 1) دفتر روزنامه. 2) دفتر كل. 3) دفتر دارائي. 4) دفتر كپيه.'
 '\u200cماده 7 - دفتر روزنامه دفتري است كه تاجر بايد همه روزه مطالبات و ديون و داد و ستد تجارتي و معاملات راجع به اوراق تجارتي (\u200cاز قبيل خريد و\u200c فروش و ظهرنويسي) و بطور كلي جميع واردات و صادرات تجارتي خود را بهر اسم و رسمي كه باشد و وجوهي را كه براي مخارج شخصي خود \u200cبرداشت ميكند در آن دفتر ثبت نمايد.']",دفتر روزنامه، دفتر کل، دفتر دارایی، و دفتر کپیه. (ماده 6),0.75,0.7452248267745935,1.0,0.9999999999666668,0.9859022629151462
6,دفتر روزنامه چه نوع اطلاعاتی را باید ثبت کند؟,دفتر روزنامه باید همه روزه مطالبات و دیون و داد و ستد تجارتی و معاملات راجع به اوراق تجارتی، واردات و صادرات تجارتی، و وجوهی که برای مخارج شخصی خود برداشت می‌کند را به صورت رسمی ثبت کند.,"['\u200cماده 7 - دفتر روزنامه دفتري است كه تاجر بايد همه روزه مطالبات و ديون و داد و ستد تجارتي و معاملات راجع به اوراق تجارتي (\u200cاز قبيل خريد و\u200c فروش و ظهرنويسي) و بطور كلي جميع واردات و صادرات تجارتي خود را بهر اسم و رسمي كه باشد و وجوهي را كه براي مخارج شخصي خود \u200cبرداشت ميكند در آن دفتر ثبت نمايد.'
 'ماده 10 - دفتر كپيه دفتري است كه تاجر بايد كليه مراسلات و مخابرات و صورت\u200cحسابهاي صادره خود را در آن بترتيب تاريخ ثبت نمايد.\n\n\u200cتبصره - تاجر بايد كليه مراسلات و مخابرات و صورت\u200c حسابهاي وارده را نيز بترتيب تاريخ ورود مرتب نموده و در لفاف مخصوصي ضبط كند.'
 'ماده 8 - دفتر كل دفتري است كه تاجر بايد كليه معاملات را لااقل هفته يكمرتبه از دفتر روزنامه استخراج و انواع مختلفه آن را تشخيص و جدا \u200cكرده هر نوعي را در صفحه مخصوصي در آن دفتر بطور خلاصه ثبت كند.']",مطالبات، دیون، داد و ستد تجارتی و معاملات راجع به اوراق تجارتی و جمیع واردات و صادرات تجارتی. (ماده 7),0.6666666666666666,0.9510088886871758,1.0,0.9999999999666668,0.7323490968742212
7,دفتر کل چگونه باید تنظیم شود؟,متن ارائه شده خالی است، بنابراین نیازی به تنظیم دفتر کل نیست.,[],کلیه معاملات را لااقل هفته یک مرتبه از دفتر روزنامه استخراج و ثبت کند. (ماده 8),,0.0,1.0,0.0,0.2107525662046489
8,دفتر دارایی چه اطلاعاتی را شامل می‌شود؟,دفتر دارایی شامل اسناد، صورت حساب‌ها، توضیحات مورد نیاز، حساب‌های سود و زیان، ترازنامه و وضعیت مالی شرکت است.,"['شركت گواهي نمايند كه كليه دفاتر و اسناد و صورت حساب\u200cهاي شركت و\u200cتوضيحات مورد لزوم در اختيار آنها قرار داشته و حساب\u200cهاي سود و زيان و ترازنامه تنظيم شده از طرف هيأت مديره وضع مالي شركت را بنحو\u200cصحيح و روشن نشان ميدهد.'
 'ماده 438 - انبارها و حجره\u200cها و صندوق و اسناد و دفاتر و نوشتجات و اسباب و اثاثيه تجارتخانه و منزل تاجر بايد مهر موم شود.']",صورت جامعی از کلیه دارایی منقول و غیر منقول و دیون و مطالبات سال گذشته. (ماده 9),,0.9458223801656046,0.0,0.9999999999,0.7155070442004211
9,نحوه ثبت مراسلات و مخابرات در دفتر کپیه چگونه است؟,مراسلات و مخابرات باید توسط تاجر به ترتیب تاریخ ثبت شوند و در دفتر کپیه ضبط شوند.,['ماده 10 - دفتر كپيه دفتري است كه تاجر بايد كليه مراسلات و مخابرات و صورت\u200cحسابهاي صادره خود را در آن بترتيب تاريخ ثبت نمايد.\n\n\u200cتبصره - تاجر بايد كليه مراسلات و مخابرات و صورت\u200c حسابهاي وارده را نيز بترتيب تاريخ ورود مرتب نموده و در لفاف مخصوصي ضبط كند.'],کلیه مراسلات و مخابرات و صورت‌حساب‌های صادره باید ترتیب تاریخ ثبت شود. (ماده 10),1.0,0.7803362518831065,1.0,0.9999999999,0.7340815912389581
10,قبل از استفاده، کدام دفاتر باید توسط نماینده اداره ثبت امضا شوند؟,دفاتر مذکور در ماده 6 باید قبل از آنکه در آن چیزی نوشته شده باشد، توسط نماینده اداره ثبت امضا شوند.,"['ماده 11 - دفاتر مذكور در ماده 6 به استثناءِ دفتر كپيه قبل از آنكه در آن چيزي نوشته شده باشد بتوسط نماينده اداره ثبت (\u200cكه مطابق نظامنامه \u200cوزارت عدليه معين ميشود) امضاء خواهد شد. براي دفتر كپيه امضاءِ مزبور لازم نيست ولي بايد اوراق آن داراي نمره ترتيبي باشد. در موقع تجديد \u200cساليانه هر دفتر مقررات اين'
 '\u200cماده 12 - دفتري كه براي امضاء بمتصدي امضاء تسليم ميشود بايد داراي نمره ترتيبي و قيطان كشيده باشد و متصدي امضاء مكلف است\u200c صفحات دفتر را شمرده در صفحه اول و آخر هر دفتر مجموع عدد صفحات آنرا با تصريح باسم و رسم صاحب دفتر نوشته با قيد تاريخ امضاء و دو\u200c طرف قيطان را با مهر سربي كه وزارت عدليه براي اين'
 'باب دوم \u200cدفاتر تجارتي و دفتر ثبت تجارتي\n\nفصل اول\n\nدفاتر تجارتي\n\nماده 6 - هر تاجري به استثناي كسبه جزء مكلف است دفاتر ذيل يا دفاتر ديگري را كه وزارت عدليه بموجب نظامنامه قائم\u200cمقام اين دفاتر قرار\u200cميدهد داشته باشد: 1) دفتر روزنامه. 2) دفتر كل. 3) دفتر دارائي. 4) دفتر كپيه.']",دفاتر مذکور در ماده 6 به استثناء دفتر کپیه. (ماده 11),1.0,0.9327131272638756,1.0,0.9999999999666668,0.7255277079502322
11,چه مواردی در دفتری که برای امضا به متصدی امضا تسلیم می‌شود، باید رعایت شود؟,دفتری که برای امضا به متصدی امضا تسلیم می‌شود باید دارای نمره ترتیبی و قیطان کشیده باشد و متصدی امضا مکلف است صفحات دفتر را شمرده و مجموع عدد صفحات آنرا با تصریح باسم و رسم صاحب دفتر نوشته با قید تاریخ امضاء و دو طرف قیطان را با مهر سربی که وزارت عدلیه برای این منظور تعیین کرده است، امضاء کند.,"['ماده 11 - دفاتر مذكور در ماده 6 به استثناءِ دفتر كپيه قبل از آنكه در آن چيزي نوشته شده باشد بتوسط نماينده اداره ثبت (\u200cكه مطابق نظامنامه \u200cوزارت عدليه معين ميشود) امضاء خواهد شد. براي دفتر كپيه امضاءِ مزبور لازم نيست ولي بايد اوراق آن داراي نمره ترتيبي باشد. در موقع تجديد \u200cساليانه هر دفتر مقررات اين'
 '\u200cماده 12 - دفتري كه براي امضاء بمتصدي امضاء تسليم ميشود بايد داراي نمره ترتيبي و قيطان كشيده باشد و متصدي امضاء مكلف است\u200c صفحات دفتر را شمرده در صفحه اول و آخر هر دفتر مجموع عدد صفحات آنرا با تصريح باسم و رسم صاحب دفتر نوشته با قيد تاريخ امضاء و دو\u200c طرف قيطان را با مهر سربي كه وزارت عدليه براي اين'
 'بايد در صورت\u200c مجلس كيفيت دفاتر را بطور خلاصه قيد كند - اوراق تجارتي هم كه وعده آنها نزديك است يا بايد قبولي آنها نوشته شود و يا\u200c نسبت بآنها بايد اقدامات تأمينيه بعمل آيد از توقيف خارج شده در صورت\u200c مجلس ذكر و بمدير تصفيه تحويل ميشود تا وجه آنرا وصول نمايد و \u200cفهرستي كه از مدير تصفيه گرفته ميشود بعضو']",دارای نمره ترتیبی و قیطان کشیده باشد و صفحات آن شمرده شود. (ماده 12),1.0,0.7413543115694704,1.0,0.99999999995,0.8312740565542582
12,ممنوعیت‌هایی در نگهداری دفاتر چه هستند؟,تراشیدن، حک کردن، جای سفید گذاشتن بیش از حد معمول، و نوشتن در حاشیه یا بین سطور از ممنوعیت‌های نگهداری دفاتر است.,"['ماده 438 - انبارها و حجره\u200cها و صندوق و اسناد و دفاتر و نوشتجات و اسباب و اثاثيه تجارتخانه و منزل تاجر بايد مهر موم شود.'
 'ماده 13 - كليه معاملات و صادرات و واردات در دفاتر مذكوره فوق بايد بترتيب تاريخ در صفحات مخصوصه نوشته شود - تراشيدن و حك\u200cكردن و همچنين جاي سفيد گذاشتن بيش از آنچه كه در دفترنويسي معمول است و در حاشيه و يا بين سطور نوشتن ممنوع است و تاجر بايد تمام آن\u200c دفاتر را از ختم هر سالي لااقل تا ده سال نگاهدارد.']",تراشیدن، حک‌کردن، جای سفید گذاشتن بیش از حد معمول، و در حاشیه یا بین سطور نوشتن ممنوع است. (ماده 13),1.0,0.7807375531595868,1.0,0.49999999995,0.7458894791744686
13,دفاتر مطابق مقررات چه اعتباری دارند؟,دفاتر تجارتی مطابق مقررات باید دارای دفتر روزنامه، دفتر کل، دفتر دارایی و دفتر کپیه باشند.,"['بايد در صورت\u200c مجلس كيفيت دفاتر را بطور خلاصه قيد كند - اوراق تجارتي هم كه وعده آنها نزديك است يا بايد قبولي آنها نوشته شود و يا\u200c نسبت بآنها بايد اقدامات تأمينيه بعمل آيد از توقيف خارج شده در صورت\u200c مجلس ذكر و بمدير تصفيه تحويل ميشود تا وجه آنرا وصول نمايد و \u200cفهرستي كه از مدير تصفيه گرفته ميشود بعضو'
 'باب دوم \u200cدفاتر تجارتي و دفتر ثبت تجارتي\n\nفصل اول\n\nدفاتر تجارتي\n\nماده 6 - هر تاجري به استثناي كسبه جزء مكلف است دفاتر ذيل يا دفاتر ديگري را كه وزارت عدليه بموجب نظامنامه قائم\u200cمقام اين دفاتر قرار\u200cميدهد داشته باشد: 1) دفتر روزنامه. 2) دفتر كل. 3) دفتر دارائي. 4) دفتر كپيه.']",بین تجار در امور تجارتی سندیت دارند. (ماده 14),1.0,0.8893930985835983,0.0,0.0,0.220978359375064
14,تخلف از کدام مواد مستلزم جزای نقدی است؟,تخلف از ماده 548 مستلزم جزای نقدی است.,['\u200cماده 548 - مخارج تعقيبي كه از طرف يكي از طلبكارها بعمل مي\u200cآيد در صورت محكوميت تاجر ورشكسته بعهده دولت و در صورت برائت \u200cذمه بعهده تعقيب\u200c كننده است.\n\nفصل دوم\n\nدر ورشكستگي به تقلب'],تخلف از ماده 6 و ماده 11. (ماده 15),0.0,0.902770478721322,1.0,0.9999999999,0.594993915749715
15,چه کسانی باید نام خود را در دفتر ثبت تجارتی به ثبت برسانند؟,کلیه اشخاصی که در نقاط بشغل تجارت اشتغال دارند اعم از ایرانی و خارجی با استثنای کسبه جزء باید نام خود را در دفتر ثبت تجارتی به ثبت برسانند.,"['ماده 16 - در نقاطي كه وزارت عدليه مقتضي دانسته و دفتر ثبت تجارتي تأسيس كند كليه اشخاصي كه در آن نقاط بشغل تجارت اشتغال دارند اعم\u200cاز ايراني و خارجي باستثناي كسبه جزء بايد در مدت مقرر اسم خود را در دفتر ثبت تجارتي به ثبت برسانند و الا بجزاي نقدي از 000 /000 /10 تا 000 /000 /60 ريال محكوم خواهند شد.'
 '1 - نام شركت و شماره ثبت آن در دفتر ثبت شركتها.\n\n2 - مبلغ سرمايه ثبت شده و مقدار پرداخت شده آن.\n\n3\n\nتعيين نوع سهم.\n\n4 - مبلغ اسمي سهم و مقدار پرداخت شده آن به حروف و بااعداد.\n\n5 - تعداد سهامي كه هر ورقه نماينده آنست.'
 'ماده 10 - دفتر كپيه دفتري است كه تاجر بايد كليه مراسلات و مخابرات و صورت\u200cحسابهاي صادره خود را در آن بترتيب تاريخ ثبت نمايد.\n\n\u200cتبصره - تاجر بايد كليه مراسلات و مخابرات و صورت\u200c حسابهاي وارده را نيز بترتيب تاريخ ورود مرتب نموده و در لفاف مخصوصي ضبط كند.']",کلیه اشخاصی که به شغل تجارت اشتغال دارند، اعم از ایرانی و خارجی با استثنای کسبه جزء. (ماده 16),0.6666666666666666,0.9679302999629952,1.0,0.9999999999666668,0.7386099684933395
16,وظایف وزارت عدلیه در رابطه با دفتر ثبت تجارتی چیست؟,وزارت عدلیه مقررات مربوط به دفتر ثبت تجارتی را با تصریح بموضوعاتی که باید به ثبت برسد، بموجب نظامنامه معین خواهد کرد.,"['باب دوم \u200cدفاتر تجارتي و دفتر ثبت تجارتي\n\nفصل اول\n\nدفاتر تجارتي\n\nماده 6 - هر تاجري به استثناي كسبه جزء مكلف است دفاتر ذيل يا دفاتر ديگري را كه وزارت عدليه بموجب نظامنامه قائم\u200cمقام اين دفاتر قرار\u200cميدهد داشته باشد: 1) دفتر روزنامه. 2) دفتر كل. 3) دفتر دارائي. 4) دفتر كپيه.'
 'ماده 438 - انبارها و حجره\u200cها و صندوق و اسناد و دفاتر و نوشتجات و اسباب و اثاثيه تجارتخانه و منزل تاجر بايد مهر موم شود.'
 'ماده 17 - مقررات مربوطه بدفتر ثبت تجارتي را وزارت عدليه با تصريح بموضوعاتي كه بايد به ثبت برسد بموجب نظامنامه معين خواهد كرد.']",مقررات مربوط به دفتر ثبت تجارتی را معین می‌کند. (ماده 17),1.0,0.8932346605439073,1.0,0.3333333333,0.7329014970428567
17,تاجر باید چه اطلاعاتی را در اسناد خود ذکر کند؟,تاجر باید کلیه مراسلات، مخابرات، صورت‌حساب‌های صادره و وارده خود را بترتیب تاریخ ثبت کند.,"['ماده 10 - دفتر كپيه دفتري است كه تاجر بايد كليه مراسلات و مخابرات و صورت\u200cحسابهاي صادره خود را در آن بترتيب تاريخ ثبت نمايد.\n\n\u200cتبصره - تاجر بايد كليه مراسلات و مخابرات و صورت\u200c حسابهاي وارده را نيز بترتيب تاريخ ورود مرتب نموده و در لفاف مخصوصي ضبط كند.'
 '\u200cماده 7 - دفتر روزنامه دفتري است كه تاجر بايد همه روزه مطالبات و ديون و داد و ستد تجارتي و معاملات راجع به اوراق تجارتي (\u200cاز قبيل خريد و\u200c فروش و ظهرنويسي) و بطور كلي جميع واردات و صادرات تجارتي خود را بهر اسم و رسمي كه باشد و وجوهي را كه براي مخارج شخصي خود \u200cبرداشت ميكند در آن دفتر ثبت نمايد.'
 'ماده 438 - انبارها و حجره\u200cها و صندوق و اسناد و دفاتر و نوشتجات و اسباب و اثاثيه تجارتخانه و منزل تاجر بايد مهر موم شود.']",تصریح نماید که تحت چه نمره‌ای به ثبت رسیده. (ماده 18),1.0,0.8250110811320722,0.8,0.9999999999,0.2157276527375569
18,شناسایی کسبه جزء در چه صورتی انجام می‌گیرد؟,با استفاده از علامت [] که در اینجا استفاده شده است.,[],مطابق مقررات نظامنامه وزارت عدلیه. (ماده 19),,0.8432148614298933,1.0,0.0,0.1995965288360363
19,انواع شرکت‌های تجارتی کدامند؟,"انواع شرکت‌های تجارتی شامل:
1) شرکت سهامی
2) شرکت با مسئولیت محدود
3) شرکت تضامنی
4) شرکت مختلط غیر سهامی
5) شرکت مختلط سهامی
6) شرکت نسبی
7) شرکت تعاونی تولید و مصرف می‌باشند.","['باب سوم\n\n\u200cشركتهاي تجارتي\n\nفصل اول \u200cدر اقسام مختلفه شركت ها و قواعد راجعه بآنها\n\nماده 20 - شركتهاي تجارتي بر هفت قسم است: 1) شركت سهامي. 2) شركت با مسئوليت محدود. 3) شركت تضامني. 4) شركت مختلط غير سهامي. 5) شركت مختلط سهامي. 6) شركت نسبي. 7) شركت تعاوني توليد و مصرف.\n\nمبحث اول\n\n\u200cشركت\u200cهاي سهامي'
 'ماده 4(الحاقي 24ˏ12ˏ1347)- شركت سهامي بدو نوع تقسيم ميشود: \u200cنوع اول - شركتهائي كه مؤسسين آنها قسمتي از سرمايه شركت را از طريق فروش سهام بمردم تأمين ميكنند. اينگونه شركتها شركت سهامي عام \u200cناميده ميشوند. \u200cنوع دوم - شركتهائي كه تمام سرمايه آنها در موقع تأسيس منحصراً توسط مؤسسين تأمين گرديده است.'
 'ماده 4 - معاملات غير منقول بهيچوجه تجارتي محسوب نميشود.\n\nماده 5 - كليه معاملات تجار تجارتي محسوب است مگر اينكه ثابت شود معامله مربوط بامور تجارتي نيست.\n\nباب دوم \u200cدفاتر تجارتي و دفتر ثبت تجارتي\n\nفصل اول\n\nدفاتر تجارتي']",شرکت سهامی، با مسئولیت محدود، تضامنی، مختلط غیر سهامی، مختلط سهامی، نسبی، و تعاونی تولید و مصرف. (ماده 20),1.0,0.9675450480552652,1.0,0.9999999999666668,0.9838098033689744
0,,,,,0.8872549019607843,0.7348603684792943,0.8400000000000001,0.6749999999558334,0.6063828848498887
